tweet,date,weekStarting
@VH1 How'd you guys get a mini palm tree on the internet? I'm not sure I'm comfortable with this.,2014-03-27,2014-03-23
Never waste a shore leave. #CaptainsOrders,2014-03-28,2014-03-23
"Dear Maidens, thank you. Love, #CaptainMorgan",2014-03-28,2014-03-23
@evancruse23 it's going to cost you 3 gold schillings.,2014-03-28,2014-03-23
"You, me and the weekend. #CaptainMorgan",2014-03-28,2014-03-23
RT @nykolegalifos: Partying with @CaptainMorganUS tonight ? #newwhiterum #sogood,2014-03-28,2014-03-23
"On this day in 1671, I swabbed my own deck. Just kidding, I’m the Captain, I swab nothing and like it. #TBT #ThrowbackThursday",2014-03-28,2014-03-23
@kevquilliam this is true.,2014-03-28,2014-03-23
Bring the weekend to its knees. #CaptainMorgan,2014-03-29,2014-03-23
It's Friday. I believe I've said enough. #CaptainMorgan,2014-03-29,2014-03-23
"Be the bigger Captain. In fact, be the biggest Captain. Trust me, it’s a great life. #CaptainMorgan",2014-03-30,2014-03-30
"I fear nothing. Not even a swarm of dead, maniac zombies who enjoy walking and trying to eat me.",2014-03-31,2014-03-30
This is a ride built for smooth.  #NewCaptain,2014-03-31,2014-03-30
I scoff at Mondays. You should too. #CaptainsOrders,2014-03-31,2014-03-30
Everything’s an adventure if you let it be. #LifeLoveLoot,2014-03-31,2014-03-30
"I've been told that half-alive, half-dead, power walking zombies don't like the delicious taste of spiced rum. Just something to consider.",2014-03-31,2014-03-30
Argg yourself @DJMany,2014-03-31,2014-03-30
There's literally only one way to enjoy Captain Morgan Taco Rum. So watch. Then Learn. Then #Taco.,2014-04-01,2014-03-30
@Ma2th3w @JoesDaily Stop internet-yelling at us.,2014-04-01,2014-03-30
@DadatworkNJ @MANjrcom Please make sure you taco responsibly.,2014-04-01,2014-03-30
"@darrenrovell well thank you, but we can't take all the credit. Tacos did most of the heavy-lifting.",2014-04-01,2014-03-30
Introducing the new Captain Morgan Taco Rum. You’ve never tasted taco rum quite like this before. #LifeLoveLoot,2014-04-01,2014-03-30
"@DevanDox @chrissyteigen No need to feel uneasy, just embrace all that is Taco Rum and everything will be taco. #taco",2014-04-01,2014-03-30
"RT @darrenrovell: Captain Morgan just unveiled Taco flavor. Hoping it's not a joke, but I'm sure it is",2014-04-01,2014-03-30
RT @foodbevnews: Captain of All Rum Spices Up #TacoTuesday Fiestas,2014-04-01,2014-03-30
Don’t miss your chance to be one of the first to get a bottle of Captain Morgan Taco Rum:,2014-04-01,2014-03-30
"@NicRatermanis @chrissyteigen Well, you kinda weird me out.",2014-04-01,2014-03-30
@chrissyteigen @DevanDox #all #taco #everything #taco,2014-04-01,2014-03-30
"Captain Morgan Taco Rum is 5 times taco’d for a smoother, fiesta-like taste. #LifeLoveLoot #taco",2014-04-01,2014-03-30
@South17Dayton @ChipotleTweets This isn't about matters of the heart. It's about matters of the taco.,2014-04-01,2014-03-30
"@FlintSkinny well it's a ship, boats are for sailors. And if by ""foolish"" you mean ""I love tacos,"" then yes, you are correct.",2014-04-01,2014-03-30
@Chargolis Please see our next tweet for the official Taco Rum recipe.,2014-04-01,2014-03-30
"To live is to taco, to taco is to live. @DelTaco knows what we’re talkin’ about.",2014-04-01,2014-03-30
"@chrissyteigen @ZMEnos You'll always be right, even if you never wanna be. #taco",2014-04-01,2014-03-30
RT @FoodPack: Only the Captain can pack taco taste in a bottle,2014-04-01,2014-03-30
@vlove87 @chrissyteigen Only if you truly believe in the power of the taco. #taco,2014-04-01,2014-03-30
"Your dreams have been answered, @ChipotleTweets, Taco Rum is here. And don’t pretend like this isn’t your dream:",2014-04-01,2014-03-30
RT @DevanDox: @CaptainMorganUS @chrissyteigen That's the best mindset ever. Everything is taco.,2014-04-01,2014-03-30
"They say necessity is the mother of invention. Well, I say necessity is the Captain of Tacos. #CaptainMorgan",2014-04-01,2014-03-30
@Steve_Indigo the magic that is Taco Rum can be found here:,2014-04-01,2014-03-30
"We’re not saying our Taco Rum would taste better with a @TacoBell taco, but we’re also not not saying it.",2014-04-01,2014-03-30
@darrenrovell You can ever be too sure when it involves having all your taco dreams come to life in one magical bottle.,2014-04-01,2014-03-30
"@CaptainAce19 Please focus your energy on the excitement part of that last tweet, Captain Ace.",2014-04-01,2014-03-30
Click here to get your hands on a bottle of Captain Morgan Taco Rum before it hits stores worldwide:,2014-04-01,2014-03-30
RT @Canty4Liberty: @CaptainMorganUS Taco rum sounds interesting. That and @TacoBell will be a perfect way to celebrate my Cinco De Mayo bir…,2014-04-01,2014-03-30
@P8ntDesk It's everything you've ever dreamed of...and more.,2014-04-01,2014-03-30
"RT @chrissyteigen: It legit tastes like liquid taco and I gotta say, my eclectic palate is not mad at it @captainmorganUS",2014-04-01,2014-03-30
"RT @TracyPendergast: Just poured myself a refreshing Taco Rum &amp; Coke after a long day. Thanks @CaptainMorganUS! Or should I say, gracias.. …",2014-04-02,2014-03-30
Looks like the joke's on me. Some people actually want a taco flavored rum? #TacosForDays #AprilFools,2014-04-02,2014-03-30
"A taco flavored rum?? Come on, mates. The Captain knows better than that.  #AprilFools",2014-04-02,2014-03-30
"The tacocat is out of the bag. Our Taco flavored rum isn’t real. Sorry, mates. #AprilFools",2014-04-02,2014-03-30
Life is like a bottle of #CaptainMorgan. You never know how much fun it’s gonna be.,2014-04-03,2014-03-30
"Go on, let the Captain out of the satchel. #LifeLoveLoot",2014-04-03,2014-03-30
Weekdays were made to be dominated. #LifeLoveLoot,2014-04-04,2014-03-30
Crew up and go out. It’s Thursday. #CaptainsOrders,2014-04-04,2014-03-30
"@captainfreddie Silver is a spiced rum, while Captain Morgan White is a 5x distilled White Rum, with no spice.  Both are delicious.",2014-04-04,2014-03-30
"Spice or no spice, the Captain always prevails. #NoSpiceAllCaptain",2014-04-04,2014-03-30
A crew is only as strong as its weakest link. Don’t be that link. #LifeLoveLoot,2014-04-05,2014-03-30
"If you’re going to do it, own it. #LifeLoveLoot",2014-04-05,2014-03-30
"A Captain in the hand is worth two in the bush. Doesn’t make sense? Good, just put a Captain in your hand.",2014-04-05,2014-03-30
Grab your crew. Grab some Captain. Grab a lot of life. #LifeLoveLoot,2014-04-06,2014-04-06
A little birdie told me to get out and start living. So go. Go now and be victorious. #LifeLoveLoot,2014-04-06,2014-04-06
Fate worse than death? Staying in on a weekend.,2014-04-06,2014-04-06
"""All Men Must Die?” Hahahahahahahahahahahahahaha. Yeah, right.",2014-04-07,2014-04-06
When in Rome... or wherever that stupid iron throne is.,2014-04-07,2014-04-06
Safe travels are the only travels. #AlwaysInModeration,2014-04-08,2014-04-06
Always be a sight for sore eyes. #CaptainMorgan,2014-04-08,2014-04-06
Who will be the Captain of the Big Dance?,2014-04-08,2014-04-06
"@CleanDropMobile @chrissyteigen @staychad Your sporadic use of capitalization is a tad frightening but otherwise, love the energy.",2014-04-09,2014-04-06
"@chrissyteigen @BackInTheFray Come on Chris, ""tasteful"" is my middle name. You know that.",2014-04-09,2014-04-06
"@IAmBrandi Welcome aboard and congratulations on being a Mario Kart champion, whatever that may be. Is it like a wheelbarrow named Mario?",2014-04-09,2014-04-06
RT @chrissyteigen: Follow @CaptainMorganUS and retweet this before 11pm ET on 4/10 for a chance to win a signed poster of me! (US only &amp; 21…,2014-04-09,2014-04-06
Tuesday night is the new 3-day weekend. #CaptainMorgan,2014-04-09,2014-04-06
All’s well that ends with the Captain. #LifeLoveLoot,2014-04-10,2014-04-06
All the world’s a stage. My stage. Shall we dance?,2014-04-10,2014-04-06
On this day in 1671...#TBT #ThrowbackThursday,2014-04-11,2014-04-06
Has the Captain got your tongue? Excellent.,2014-04-11,2014-04-06
"All that glitters is not gold, but all that’s gold is mine. #LifeLoveLoot",2014-04-12,2014-04-06
"Come hell or high water, we’re living life to the fullest tonight. #CaptainMorgan",2014-04-12,2014-04-06
Be the pirate of the party. Live to #LifeLoveLoot,2014-04-13,2014-04-13
One hand’s always going to be jealous...,2014-04-13,2014-04-13
Like two peas in a pod full of awesome. #CaptainandCola,2014-04-15,2014-04-13
Time to celebrate not worrying about #TaxDay for another 364 more days.,2014-04-16,2014-04-13
"Hey Tuesday night, I’m coming for you. Sincerely, #CaptainMorgan",2014-04-16,2014-04-13
Solid choice @WirtzbevIL @UntitledChicago. Always follow #CaptainsOrders,2014-04-17,2014-04-13
RT @UntitledChicago: @CaptainMorganUS @WirtzbevIL @The_National Such a great time last night. Thx for hosting it with us. #AmazingMusic #Lo…,2014-04-17,2014-04-13
The long quest for @NHL Playoff glory begins tonight.,2014-04-17,2014-04-13
And you're an all time favorite maiden of mine @GeminiPersuasn.,2014-04-17,2014-04-13
Be a weekday warrior. #CaptainsOrders,2014-04-17,2014-04-13
On this day in 1671… I swam with a mermaid. She couldn’t keep up. #TBT #ThrowbackThursday,2014-04-18,2014-04-13
Adventure is as Captain does. #CaptainsOrders,2014-04-19,2014-04-13
"Yes, I’m talking to you. #CaptainMorgan",2014-04-19,2014-04-13
Rally your crew and storm the night. #CaptainsOrders,2014-04-20,2014-04-20
Tonight we Captain like there is a tomorrow. #LifeLoveLoot,2014-04-20,2014-04-20
It’s always noon somewhere...,2014-04-20,2014-04-20
Happy Patriot’s Day America.,2014-04-22,2014-04-20
It’s not a victory until your ship has been docked. #AlwaysInModeration,2014-04-23,2014-04-20
"RT @RoosterTeeth: New Slow Mo Guys episode! This time with special guest @CaptainMorganUS, a cannon and a pyramid of daiquiris.",2014-04-23,2014-04-20
No sugar. No Spice. Tastes great on ice. #NewCaptain #NoSpiceAllCaptain,2014-04-23,2014-04-20
Respect the sea and it shall respect you. #AlwaysInModeration,2014-04-24,2014-04-20
Not every great present needs fancy wrapping paper. #CaptainMorgan,2014-04-24,2014-04-20
"Sounds about right to me, @SierraGunderson.",2014-04-25,2014-04-20
Watch @GavinFree and @DanielGruchy blow up boring rum stuff with a cannonball because it’s awesome. #SlowMotion,2014-04-25,2014-04-20
On this day in 1671…#TBT #ThrowbackThursday,2014-04-25,2014-04-20
Want a free Cannonball? Just enter this easy contest. Watch stuff blow up. Get Cannonballed. #Boom,2014-04-25,2014-04-20
Keep it O.G. with #CaptainandCola,2014-04-26,2014-04-20
Captain &amp; Cola go together like pirates and adventure. #CaptainMorgan,2014-04-26,2014-04-20
Crew up and get out. #CaptainMorgan,2014-04-27,2014-04-27
"It’s your life, start adventuring already. #LifeLoveLoot",2014-04-27,2014-04-27
"Spice or no spice, the Captain always prevails.  #NoSpiceAllCaptain",2014-04-28,2014-04-27
"Shot through the drink, and you're too late. You gave rum, a bad name. #SlowMotion",2014-04-28,2014-04-27
Know when to take the lead. #AlwaysInModeration,2014-04-28,2014-04-27
"A picture is worth a thousand words, but some Captain is worth one: fun. #CaptainMorgan",2014-04-29,2014-04-27
Check out my infamous “Spice Merchant” cocktail from last night’s #BarRescue on @Spiketv.,2014-04-29,2014-04-27
RT @RoosterTeeth: See what happens when @GavinFree and @DanielGruchy swing an anchor at a pallet of daiquiris.,2014-04-30,2014-04-27
"A diamond is forever, but #CaptainMorgan is for tonight.",2014-04-30,2014-04-27
"Hey internet, I'm gonna be spending the next four days at @SunfestFL. I’ll be the one in the red coat dominating fun.",2014-04-30,2014-04-27
Watch the @GavinFree and @DanielGruchy absolutely destroy boring rum drinks with my old anchor.,2014-04-30,2014-04-27
"Don’t fret, the #NewCaptain isn’t going anywhere. #NoSpiceAllCaptain",2014-04-30,2014-04-27
"It’s Wednesday, do you know where your #CaptainMorgan is?",2014-04-30,2014-04-27
The time has come to party with #CaptainMorgan,2014-05-01,2014-04-27
"Enter this easy Facebook contest &amp; you could win a Cannonball. The one you drink from, not the one that goes #boom.",2014-05-01,2014-04-27
The Captain is in your Court.,2014-05-01,2014-04-27
"Hey, everyone at @SunFestFL, come find me at the #CaptainMorgan Floating Barges if you like delicious rum and unforgettable evenings.",2014-05-01,2014-04-27
Captain Morgan is the official rum sponsor of the @NHL.,2014-05-01,2014-04-27
I’ve got a whole slew of “try before you buy” temporary tattoos at my @SunfestFL Party Barge. Come get a sleeve on me. #FloatingOasis,2014-05-02,2014-04-27
@j_rummmm @Tyler_Mountains I don't think I need to even answer that question.,2014-05-02,2014-04-27
RT @JoesDaily: Celebrate this weekend's #KentuckyDerby w/ @CaptainMorganUS #MintMutiny recipe.,2014-05-02,2014-04-27
"@SebASS_G watch it, mate. That language only flies in international waters.",2014-05-02,2014-04-27
All hail the #NewCaptain of Happy Hour. You.,2014-05-02,2014-04-27
"They can keep their hats, I’m just gonna make their drink better. Introducing the Mint Mutiny, mix one up today:",2014-05-02,2014-04-27
"Quick life reminder, never not be awesome. And if you need a little help with that, come #LifeLoveLoot with me at @SunfestFL.",2014-05-02,2014-04-27
"Boring rum drinks, meet my anchor. Also, it doesn’t like you.",2014-05-02,2014-04-27
RT @Lushworthy: Drink Recipe: @CaptainMorganUS &amp; @HughAcheson (of @ESSouth) Set The Stage For A #MintMutiny,2014-05-02,2014-04-27
"It’s like, yeah. This is great.",2014-05-03,2014-04-27
RT @Deshair: Dear @KentuckyDerby please tell Bob Costas to put his leg down ? he's not @CaptainMorganUS,2014-05-03,2014-04-27
Follow and RT for a chance to win these Mint Mutiny chalices #mintmutinysweeps. See rules:,2014-05-03,2014-04-27
Let us all raise a #MintMutiny to horses being horses and big hats being stupid.,2014-05-03,2014-04-27
"Are you feeling the North, Middle or South Oasis at @SunfestFL? Come see for yourself at the #CaptainMorgan barges.",2014-05-03,2014-04-27
"@mattyschwarz strong move, mate.",2014-05-03,2014-04-27
"You, me, the weekend, and @Jcolenc. What more could you want at @SunfestFL?",2014-05-03,2014-04-27
"I just lit this @SunFestFL stage up. You're welcome, @JColeNC.",2014-05-03,2014-04-27
The plank is just a cool wooden diving board used purely for recreational activities.,2013-12-30,2013-12-29
@proglegs we appreciate your message as we are not a sponsor of the Rush Limbaugh Show and did not buy ads on the show.,2013-12-31,2013-12-29
We appreciate your comments about the Rush Limbaugh Show as we are not a sponsor of the show and did not purchase ads on the show.,2013-12-31,2013-12-29
@bobroseman we appreciate your message as we are not a sponsor of the Rush Limbaugh Show and did not buy ads on the show.,2013-12-31,2013-12-29
"When in doubt, don’t Captain your own ship. #AlwaysInModeration",2014-01-01,2013-12-29
"Tonight we throw caution to the wind, and anything else you damn-well please.",2014-01-01,2013-12-29
I hope everyone has fun staying inside and being scared of frozen water. #Hercules,2014-01-03,2013-12-29
Every crew needs a Captain. Tonight it’s your turn.,2014-01-03,2013-12-29
"I've never seen snow or #Hercules. I've always been too busy battling 60 foot waves, giant squids and people trying to steal my bounty.",2014-01-03,2013-12-29
"In the 17th century, America wasn’t a country and as for the British...  I decided to sail the oceans blue for a reason. #americansvsbritish",2014-01-04,2013-12-29
"Don’t raise a finger to your bartender, just give’em the Captain stare. They’ll get it, they always do.",2014-01-04,2013-12-29
We set sail at nightfall. Every nightfall. #LiveLoveLoot,2014-01-05,2014-01-05
Some traditions are hard to break. #CaptainandCola,2014-01-05,2014-01-05
"When in doubt, stowaway yourself. #AlwaysInModeration",2014-01-06,2014-01-05
OG before OG was OG. #CaptainandCola,2014-01-06,2014-01-05
Well this makes it pretty clear that the only way to battle the #PolarVortex is with a little Captain:,2014-01-07,2014-01-05
Rum and chai go together like a great beard and me.,2014-01-08,2014-01-05
Never shove off in rocky waters. #AlwaysInModeration,2014-01-09,2014-01-05
"I once went a year without losing a toe. I did lose my leg, but all my toes were still on the foot. #ThrowbackThursday #TBT",2014-01-10,2014-01-05
"Yes, the best can keep getting better. #CaptainandCola",2014-01-11,2014-01-05
Sometimes you find a first mate you can always trust. Sometimes. #CaptainandCola,2014-01-11,2014-01-05
"Is ""adventure"" your middle name? Well it shouldn't be. Mine's ""Paul."" “Adventure” is a stupid middle name. #CaptainMorgan",2014-01-12,2014-01-12
Don’t let Sunday overthrow you. Plan a mutiny of adventurous proportions. #LiveLoveLoot,2014-01-13,2014-01-12
"Slow down, sailor. RT: @BlkSails_Starz Best listen closely. These will be the last words you hear. #BloodyTruth #BlackSails",2014-01-14,2014-01-12
Some journeys are worth waiting for. #AlwaysInModeration,2014-01-14,2014-01-12
"@BlkSails_Starz now now, sailor. Someone's starting to bite off more than they can chew.",2014-01-14,2014-01-12
"Hey, @BlkSails_Starz,  I swabbed my ship's decks with your flag. Want it back?",2014-01-15,2014-01-12
"Beard-to-beard, @BlkSails_Starz? I scoff and laugh at you simultaneously.",2014-01-15,2014-01-12
Keep your crew close and your Captain closer.,2014-01-15,2014-01-12
.@BlkSails_Starz How bout I pull my tricorne hat down over my eyes then defeat you? That way I won't have to see you cry. #NationalHatDay,2014-01-15,2014-01-12
".@BlkSails_Starz, here on my ship, we call this a butter knife.",2014-01-15,2014-01-12
"I will say, these @BlkSails_Starz folk really know how to blow stuff up.",2014-01-15,2014-01-12
".@BlkSails_Starz I'll step aboard, under one condition: you hand over your ship. I'll take care of it, I promise.",2014-01-15,2014-01-12
".@BlkSails_Starz we can bury the hatchet, but I'm keeping your ship.",2014-01-16,2014-01-12
What’s medicine? #ThrowbackThursday #TBT,2014-01-17,2014-01-12
Get up. Get out. Get Captain. Get After It. #CaptainMorgan,2014-01-17,2014-01-12
Apples are boring. Spice it up. #Cider,2014-01-17,2014-01-12
An ambush of epic proportions is on the horizon.,2014-01-18,2014-01-12
This is my weekend. Stowaways welcome. #CaptainMorgan,2014-01-19,2014-01-19
Some journeys are worth waiting for. #AlwaysInModeration,2014-01-20,2014-01-19
"Check out “Fireship,” the last installment in the Captain Morgan Trilogy. And yes, it’s as awesome as it sounds.",2014-01-21,2014-01-19
"Never abandon ship. Unless you call your couch a “ship” then yes, immediately abandon ship. #CaptainMorgan",2014-01-22,2014-01-19
"Introducing Captain Morgan White Rum. Bring out those crystal goblets, a drink this smooth deserves it. #NewCaptain",2014-01-22,2014-01-19
"Bon voyage, ordinary white rum. The #NewCaptain of white rum is here, Captain Morgan White.",2014-01-23,2014-01-19
"Ordinary White Rum, consider yourself besieged. #NewCaptain",2014-01-23,2014-01-19
"Great Captain. Great ship. Great send-off. Watch “Fireship,” the final installment in the Captain Morgan Trilogy.",2014-01-24,2014-01-19
A rally isn’t a rally until you make it one.  #LifeLoveLoot,2014-01-24,2014-01-19
"In the 17th century, we called #Yolo waking up. #TBT",2014-01-24,2014-01-19
Make an entrance no one will ever forget. #NewCaptain,2014-01-25,2014-01-19
The smoothest sailing this side of everywhere. #NewCaptain,2014-01-26,2014-01-26
RT @CSNChicago: [WATCH] Some of Corey Crawford's best stops in the @CaptainMorganUS Saves of the Game --,2014-01-27,2014-01-26
RT @Elle_Tee: Lots of ?? to the new Captain Morgan White ! #Gasparilla2014 @CaptainMorganUS  #lifeloveloot,2014-01-27,2014-01-26
The #NewCaptain of white rum has arrived. Ordinary cocktails beware.,2014-01-27,2014-01-26
RT @littleredkitchn: Warm up with Orange Cinnamon Spiked Hot Chocolate for #CaptainsTable Challenge. Spiked with @CaptainMorganUS Black! ht…,2014-01-28,2014-01-26
"A smoother White Rum has arrived. Say hello to the #NewCaptain, Captain Morgan White. #SmootherSailing",2014-01-28,2014-01-26
A #NewCaptain of White Rum is here and he’s effortlessly smooth.,2014-01-28,2014-01-26
"RT @MaryeAudet: Looking for a great #superbowl #Snack? Spicy, sweet... booze and bacon!",2014-01-28,2014-01-26
Introducing Captain Morgan White. Lay down your plastic swords. #NewCaptain,2014-01-29,2014-01-26
RT @YorkshireWines: Looking to chill and relax? Look no further! #Captain Morgan Spiced Rum is what you seek #spicedrum=yes @CaptainMorganUS,2014-01-29,2014-01-26
RT @joshwhill: Love the new “Captain Morgan White Rum” commercial:,2014-01-29,2014-01-26
RT @GlassIsLife: .@CaptainMorganUS has something special for you for #superbowl. Bacon Meatloaf Cupcakes. #recipe,2014-01-29,2014-01-26
White rum has a #NewCaptain and he’s prepared to smooth things over.,2014-01-29,2014-01-26
RT @CSNChicago: Check out the @CaptainMorganUS Saves of the Game from tonight's #Blackhawks-Flames game:,2014-01-29,2014-01-26
RT @brooklynatlien: A Play-By-Play Of The Cocktails You Should Consider For #SuperBowl,2014-01-30,2014-01-26
RT @phuckawff: @CaptainMorganUS this is literally everything I could possibly ask for in a liquor thankyou captain #currentlyCaptainMorgani…,2014-01-30,2014-01-26
"Not everyone can be a leader but fortunately for you, I was born one. Follow me, follow me to internet freedom.",2014-01-30,2014-01-26
Grab some Captain Morgan White for the Big Game and be the smoothest guest at the party. #NewCaptain,2014-01-31,2014-01-26
RT @celebritymagnet: When I drink @CaptainMorganUS it makes me and others around me more interesting. @guestofaguest,2014-01-31,2014-01-26
Tried and true just got smoother. The Captain Morgan White &amp; Cola.,2014-01-31,2014-01-26
Smooth begets smooth. #ESPNTHEPARTY,2014-02-01,2014-01-26
Two teams. Three Captains. #NewCaptain,2014-02-01,2014-01-26
".@andrewsrack Ours too, mate.",2014-02-01,2014-01-26
"From one Captain to one King, Happy Birthday @howardstern, King of All Media.  Enjoy your bash.",2014-02-01,2014-01-26
Get out there and dominate. #CaptainMorgan,2014-02-02,2014-02-02
Drop anchor and put a little Captain in your cup. This is gonna be a great one. #CaptainMorgan,2014-02-02,2014-02-02
Two teams. Three Captains. #CaptainMorgan,2014-02-02,2014-02-02
It’s not just about winning.,2014-02-03,2014-02-02
My friends call me…,2014-02-03,2014-02-02
Time for a drink? #CaptainMorgan,2014-02-03,2014-02-02
A blowout and it's on Eastern Standard Time? You can still make something of this Sunday night yet. #CaptainMorgan,2014-02-03,2014-02-02
RT @momegiraffe: @BrunoMars KILLED it! Now for some more @CaptainMorganUS #whiterum!,2014-02-03,2014-02-02
Boring rum drinks have now been ruled obsolete. Start fresh with this classic:,2014-02-04,2014-02-02
Round up your crew and plan a mutiny of the mundane tonight. #CaptainMorgan,2014-02-05,2014-02-02
Delicious dark waters await.,2014-02-05,2014-02-02
The New Captain of adventure has arrived.,2014-02-06,2014-02-02
Yes that’s a painted portrait of me and no I don’t regret that mustache. #TBT #ThrowbackThursday,2014-02-06,2014-02-02
Be the bigger Captain. #AlwaysInModeration,2014-02-06,2014-02-02
RT @pinkberryatx: Thanks to @Austin_Monthly &amp; @CaptainMorganUS for inviting us to their event last night! Discovered some great new combos.,2014-02-06,2014-02-02
All hail the Captain of the night. You. #LifeLoveLoot,2014-02-07,2014-02-02
Still upset that  “Ship Building from Scratch” isn’t yet an Olympic sport at #Sochi,2014-02-07,2014-02-02
"Less frills, smoother adventures. #CaptainMorganWhite",2014-02-08,2014-02-02
Confidently. Conquer. Cocktails.  #CaptainMorgan,2014-02-09,2014-02-09
Never set sail on rocky waters. #CaptainMorgan #AlwaysInModeration,2014-02-10,2014-02-09
The #NewCaptain of white rum has dropped anchor and he’s making waves. Delicious waves.,2014-02-10,2014-02-09
Cola.  The Captain's most loyal mate. #CaptainandCola,2014-02-11,2014-02-09
Be the best Captain you can be. #LifeLoveLoot,2014-02-11,2014-02-09
What better way to announce your arrival then to smash boring beverages in slomo? #NewCaptain,2014-02-12,2014-02-09
Consider your timbers shivered. #CaptainMorgan,2014-02-12,2014-02-09
Spend happy hour with the Captain. Why? Because it's a #snowday and you're an adult. #lifeloveloot,2014-02-13,2014-02-09
Effortlessly smooth just became more effortless. #NewCaptain,2014-02-13,2014-02-09
"Triumph over boredom. Because if you don't, no one will. #CaptainMorgan",2014-02-13,2014-02-09
RT @RamboDoe: always been a close friend. thankyou @CaptainMorganUS,2014-02-13,2014-02-09
RT @chrissyteigen: Behind the scenes at the SI and @CaptainMorganUS shoot! He is most certainly keeping me company…,2014-02-13,2014-02-09
The Captain doth protest mediocrity. Will you join him?,2014-02-14,2014-02-09
Don’t forget…,2014-02-14,2014-02-09
"Congratulations to @chrissyteigen for gracing the cover of #SISwim50, you've made your Captain proud.",2014-02-14,2014-02-09
"Today we love, but only life and loot. #ValentinesDay #LifeLoveLoot",2014-02-15,2014-02-09
Prepare yourself for the smoothest entrance imaginable. #NewCaptain,2014-02-15,2014-02-09
The high seas can wait. #AlwaysInModeration,2014-02-16,2014-02-16
Never embark on an adventure without the essentials. #NewCaptain,2014-02-16,2014-02-16
Today is a national holiday. So I hope last night didn't go to waste. #CaptainMorgan,2014-02-17,2014-02-16
The original champion of adventure. #CaptainMorgan,2014-02-18,2014-02-16
Crush the common cocktail. #NewCaptain,2014-02-18,2014-02-16
To the victor goes the Captain.,2014-02-18,2014-02-16
Take an extended shore leave. #AlwaysInModeration,2014-02-18,2014-02-16
"RT @Life_and_Style: . @ChrissyTeigen, why are you &amp; @JohnLegend so adorbs? Look at him supporting her at @SI_Swimsuit!",2014-02-19,2014-02-16
