tweet,date,weekStarting
"Sunday mornings were made for sleep. If you choose to do something else with them, that’s on you.",2014-10-26,2014-10-26
"Today is #NavyDay so hug your nearest sailor or if that gets weird, buy him a Captain and whatever he wants.",2014-10-27,2014-10-26
"Keep it safe out there, #CaptainsOrders. Raise a glass, always in moderation.",2014-10-27,2014-10-26
Thursday is the night for mischief. The kind of mischief that your buddy will both love and hate you for. This kind:,2014-10-28,2014-10-26
"RT @Mike_Conrad: There is nothing better than a friend, unless it is a friend with @CaptainMorganUS",2014-10-28,2014-10-26
Afternoon coffee FTW.,2014-10-28,2014-10-26
"Get ready, I’m plundering your pumpkin beer this Halloween weekend. You’re welcome.",2014-10-28,2014-10-26
A seagull just ate from my palm. I think I just invented magic.,2014-10-28,2014-10-26
"Keep. It. Real. Raise a glass, always in moderation. #CaptainsOrders",2014-10-29,2014-10-26
“Circle back” by “EOD” really means “I’ll see you” at “Happy Hour.”,2014-10-30,2014-10-26
"Going for a quick swim with the blue whales circling my ship, brb.",2014-10-30,2014-10-26
I’ve never owned a day more than I’m owning today.,2014-10-31,2014-10-26
"Keep the stache. In fact, keep all the hair on your face. If you can grow it, you should own it.",2014-11-01,2014-10-26
It’s the end of Daylight Savings which means an extra hour of night which means...you know what it means.,2014-11-02,2014-11-02
Friends are family. Family are friends. Keep them safe. Both of them. #AlwaysInModeration,2014-11-06,2014-11-02
Our mate Brooke has the best method for scoffing at the changing seasons: A warm Spiced Cider. #ThirstyThursday,2014-11-07,2014-11-02
Let's all raise a glass to the Marines. #MarineCorpsDay,2014-11-11,2014-11-09
"Raise a glass to our Veteran's today. If it wasn't for them, we wouldn't be us.",2014-11-11,2014-11-09
"It’s Thursday &amp; I’m Thirsty. What for? Two things: Captain and Ginger. Also football. Yeah, all of those things.",2014-11-14,2014-11-09
"It’s Thursday &amp; I’m Thirsty. What for? Two things: Captain and Ginger. Also football. Yeah, all of those things.",2014-11-14,2014-11-09
Like Captain coupons? Yeah you do. Click here for limited time-only promo on Captain Morgan:,2014-11-17,2014-11-16
"This Thanksgiving, bring something more thoughtful than a jello mold.",2014-11-19,2014-11-16
'Twas The Night Before Thanksgiving (with Jenna Marbles):,2014-11-20,2014-11-16
"TBH the best part of #Thanksgiving is the night before. Why? See why, in this Rum Room Original ft. @Jenna_Marbles -",2014-11-21,2014-11-16
RT @Jenna_Marbles: I got to do this awesomeness with @CaptainMorganUS ? so real   Twas The Night Before Thanksgiving,2014-11-22,2014-11-16
Constellations are interesting. Found one that looks like a blanket. Or is that a horse?,2014-11-25,2014-11-23
"The best part of #Thanksgiving is always the night before. Why? See why, in this Rum Room Original w. @Jenna_Marbles",2014-11-25,2014-11-23
RT @AudrinaPatridge: Headed home to reunite with old friends on #ThanksgivingEve. Check out @CaptainMorganUS's take on the night:,2014-11-25,2014-11-23
"Like the Captain &amp; Cola he confidently stirs, the Pack Leader is crisp, cool and comfortably conquering.",2014-11-25,2014-11-23
"So I was just told it’s night time somewhere. How, and why am I not there?",2014-11-25,2014-11-23
"Like the Captain &amp; Ginger he drinks with a wink, The Showboat is bright, unique and not afraid of the spotlight.",2014-11-25,2014-11-23
"Like the Captain White &amp; Cran he stoically sips, The Class President is sweet, tart and always looks good in glasses.",2014-11-25,2014-11-23
"Like the Captain &amp; Cola in her hand, the Prom Queen is bubbly, sweet and reigns supreme.",2014-11-25,2014-11-23
"As the blue whales melodically woo’d me to sleep with their song, I thought, “Whales are pretty rad.” #OneSentenceBedTimeStories",2014-11-25,2014-11-23
"He may make the night awkward, but his drink is smooth - White &amp; Pineapple is enjoyed by all, even The Creepy Teacher",2014-11-25,2014-11-23
I am all that is Captain.,2014-11-26,2014-11-23
Happy Thanksgiving from the Captain and his crew.,2014-11-27,2014-11-23
Friends are family. Family are friends. Keep them safe. Both of them. #AlwaysInModeration,2014-11-27,2014-11-23
Holidays are for equal parts rum and responsibility.  #HappyThanksgiving #AlwaysInModeration,2014-11-27,2014-11-23
"As the lightening flashed and thunder rumbled, Mr. Morgan knew the sea was his everything. #OneSentenceBedTimeStories",2014-11-27,2014-11-23
"I’m coming for you, vodka.",2014-11-27,2014-11-23
I love the smell of canon powder in the morning.,2014-11-28,2014-11-23
Making Happy Hour happier since forever.,2014-11-28,2014-11-23
Just wished on a shooting star and it came true immediately. WHAT HAVE YOU DONE TODAY?,2014-11-29,2014-11-23
Moderation is truly the spice of life. #AlwaysInModeration,2014-11-30,2014-11-30
I want you to want me to want you to want some rum.,2014-11-30,2014-11-30
"As the lightening flashed and thunder rumbled, Mr. Morgan knew the sea was his everything. #OneSentenceBedTimeStories",2014-11-30,2014-11-30
RT @ChadMMurray: Check out @CaptainMorganUS's classic take on #ThanksgivingEve:,2014-12-01,2014-11-30
"Rise, shine and loot.",2014-12-01,2014-11-30
"The mates were rowdy tonight, but not nearly as rowdy as the dolphins they were chasing. #OneSentenceBedTimeStories",2014-12-02,2014-11-30
Friends are family. Family are friends. Keep them safe. Both of them. #AlwaysInModeration,2014-12-02,2014-11-30
This high seas morning commute traffic is a real nightmare today. I could swim faster.,2014-12-03,2014-11-30
A crisp ocean breeze nestled him to sleep like a crisp ocean breeze tends to do. #OneSentenceBedTimeStories,2014-12-04,2014-11-30
"Why so serious, whiskey?",2014-12-04,2014-11-30
"It’s “Thursday and I’m Thirsty.” Aren’t you? I knew it, so drink up.",2014-12-05,2014-11-30
If you’re not up right now then I question to your commitment to enjoying life.,2014-12-05,2014-11-30
It feels like gin is that grandfather who doesn’t know it’s not 1955.,2014-12-06,2014-11-30
"81 years ago today, Prohibition ended.",2014-12-06,2014-11-30
"If you were me right now, what would you do?",2014-12-07,2014-12-07
Original Spiced Rum meets Original Spiced Responsibility. Think about it. #AlwaysInModeration,2014-12-08,2014-12-07
The sand never felt so alive as it did when my toes were in it five minutes ago. #OneSentenceBedTimeStories,2014-12-08,2014-12-07
"Stop yelling so much, tequila. We hear you and frankly, we're not that impressed.",2014-12-10,2014-12-07
.@johnwhaskell there are no such things as accidents. Only dreams that come true.,2014-12-10,2014-12-07
Friends are family. Family are friends. Keep them safe. Both of them. #AlwaysInModeration,2014-12-10,2014-12-07
"Following a man into the nether regions of the sea is what I’m doing right now, he thought, as he did just that. #OneSentenceBedTimeStories",2014-12-11,2014-12-07
It’s Thursday and I’m Thirsty. Time for a cocktail. HINT/TIP/FACT: Blend this. Blend it well. #ThirstyThursday,2014-12-12,2014-12-07
"Raise the sails, my friends, for tonight we voyage into awesomeness. #OneSentenceBedTimeStories",2014-12-13,2014-12-07
"Looking a little pale there, vodka. A little sun wouldn’t kill ya.",2014-12-14,2014-12-14
"Rise, Shine and Loot.",2014-12-16,2014-12-14
"I see you seeing me and frankly, I love it.",2014-12-18,2014-12-14
It’s Thursday and I’m Thirsty – Time to punch with your pals #ThirstyThursday,2014-12-18,2014-12-14
Keep those sails up. I’m coming at Friday full steam ahead.,2014-12-18,2014-12-14
Be nice to your bosses. Especially when they open a tab.,2014-12-20,2014-12-14
Tonight is going to be the best night of all of our lives.,2014-12-20,2014-12-14
We’ve reached the longest night of the year. A.K.A. The Perfect Day.,2014-12-22,2014-12-21
To Captain is to dominate. To dominate is to Captain.,2014-12-22,2014-12-21
"In a national taste test, people preferred the taste of Captain Morgan® White Rum over Bacardi Superior Light Rum.",2014-12-23,2014-12-21
Enjoy a gift from the original red coated gentleman.,2014-12-23,2014-12-21
They will love me. I (almost) guarantee it.,2014-12-25,2014-12-21
"It’s Thursday, I’m Thirsty and it’s the holidays – make your Kringle a Captain. #ThirstyThursday",2014-12-25,2014-12-21
"Without me, New Year’s Eve will just be another night you regret not inviting me to hang out.",2014-12-26,2014-12-21
@Zakk_Cash thanks for improving life.,2014-12-30,2014-12-28
"RT @seanslaugh: ""Trust me you can dance"" - @CaptainMorganUS",2015-01-06,2015-01-04
Keep your New Years Resolutions intact w/ a Skinny Pirate. It’s a real calorie-friendly party pirate #ThirstyThursday,2015-01-09,2015-01-04
Friends are family. Family are friends. Keep them safe. Both of them. #AlwaysInModeration,2015-01-14,2015-01-11
I forgot the Captain Morgan. #FiveWordsToRuinADate,2015-01-14,2015-01-11
"Calling all Todd's, this “It’s Thursday and I’m Thirsty” is for you. Also, everybody over 21. #ThirstyThursday",2015-01-14,2015-01-11
Most taste buds refer to this cocktail as “the crispness beneath our wings.” #ThirstyThursday,2015-01-22,2015-01-18
"Just a quick reminder for any man, beast or act of Mother Nature thinking about scaring the ol' Capt. #Juno",2015-01-27,2015-01-25
"Don’t politely guilt your friends into trying your “secret” 9 cheese dip, politely SUGGEST this: #ThirstyThursday",2015-01-29,2015-01-25
"Well done, New England, but try defeating a ship or sea monster if you really want to feel alive. #SuperBowl",2015-02-02,2015-02-01
Smoothness. Deliciousness. Captainness. #ThirstyThursday,2015-02-06,2015-02-01
Three new flavors of Captain Morgan White Rum have come to rule supreme.,2015-02-07,2015-02-01
"Ahhh love is in the air. Or not, who cares, all that matters is deliciousness is in your cup. #ThirstyThursday",2015-02-12,2015-02-08
"Thursday night’s alright for delighting, isn’t it? #ThirstyThursday",2015-02-19,2015-02-15
RT @bcprmiami: .@Emeril serving up tiki-inspired cocktails at #ArtOfTiki! #Bam #SOBEWFF,2015-02-21,2015-02-15
RT @Emeril: The Art of Tiki #SOBEWFF #tiki,2015-02-21,2015-02-15
I'm at #SOBEWFF w/ @Emeril to crown a new Tiki bar king tonight. Bring on the delicious rum goodness. #CaptainMorgan,2015-02-21,2015-02-15
Watch my #1 maiden @chrissyteigen on @JimmyKimmelLive tonight. But first see her here being almost as smooth as I am:,2015-02-23,2015-02-22
Three cheers to @TheBrokenShaker’s Randy &amp; Gui for crushing the #SOBEWFF Art of Tiki People’s Choice award.,2015-02-26,2015-02-22
"Grab your mates, throw on some beach tunes and party like it’s not probably 40 degrees outside. #ThirstyThursday",2015-03-05,2015-03-01
Spring's around the corner. So prepare for white pants season by kicking off white rum season. #ThirstyThursday,2015-03-12,2015-03-08
So today is #PiDay. A day about a number that never ends. A day about math. A day I can’t believe I even acknowledged.,2015-03-14,2015-03-08
Durham is dancing. You know who else is excited to go dancing? Everybody. It’s like the garnish of a great party.,2015-03-15,2015-03-15
The Madness has begun.,2015-03-15,2015-03-15
Look at that reaction by Irvine. It screams “just happy to be here.” Don’t forget you also have to win now.,2015-03-15,2015-03-15
"Ouch. The committee was not kind to Iowa. Oh well, I always say the bigger the battle, the tastier the victory.",2015-03-15,2015-03-15
"Rally up immediately. Seriously, figure it out.",2014-07-02,2014-06-29
I just woke up flexing my abs. Awesome.,2014-07-02,2014-06-29
"This almost Independence Day, wash down those Freedom Fries with a Captain and Cola. #4thofJuly",2014-07-03,2014-06-29
I'm about to eat all the cheese.,2014-07-03,2014-06-29
"Not only does the Captain get the party started, he's also pretty nifty with the BBQ. #Happy4thofJuly.",2014-07-04,2014-06-29
USA. USA. USA. USA. USA. USA. #Happy4thofJuly.,2014-07-04,2014-06-29
It’s the day after Independence Day. Which is the best reason to continue celebrating Independence Day. #4thofJuly,2014-07-05,2014-06-29
RT @KevinHart4real: It’s about to go down. All white bday bash with @CaptainMorganUS tonight at the NYC arena,2014-07-05,2014-06-29
Is fun your middle name? What spelling do you use?,2014-07-05,2014-06-29
I am the Captain of the night.,2014-07-05,2014-06-29
"RT @VinoCaPisco: Perfect weather for making this watermelon ""gimlet"" today: @CaptainMorganUS white…",2014-07-05,2014-06-29
I am the definition of adventure.,2014-07-06,2014-07-06
Time to overthrow the tyranny of not leaving your couch all day.,2014-07-06,2014-07-06
I eat peanut butter from the jar like an adult.,2014-07-07,2014-07-06
Know the course. Stay the course. Be the course. #AlwaysInModeration,2014-07-07,2014-07-06
Champion. Need I say more?,2014-07-08,2014-07-06
Driftwood makes for a great pillow and plate.,2014-07-08,2014-07-06
Efficiency at its finest. #NewCaptain,2014-07-09,2014-07-06
Put the straw in the coffee then the straw in my mouth then go away.,2014-07-09,2014-07-06
"Hey Boston, come to any of these bars tonight for some delicious Captain and a wicked game of baseball. #BOSvsCHI",2014-07-09,2014-07-06
Your happiness means the world to me.,2014-07-09,2014-07-06
I just saw you pretend not to see me. Consequences will never the same.,2014-07-10,2014-07-06
Finish strong.,2014-07-10,2014-07-06
RT @ClarkeTorres: @CaptainMorganUS #SherryOakFinish #LimitedEdition #CaptainMorgan #Promotional #selectLocation,2014-07-10,2014-07-06
"When did this happen? - RT @AurelioVoltaire: @Joannechocolat For the record, I did not misspell illiterate. @CaptainMorganUS did!Lol!",2014-07-10,2014-07-06
Cruller me. Immediately.,2014-07-10,2014-07-06
Of course I'm real. You don't win at life daily if you're fictional...#amirite - RT @stephau819: Captain Morgan was a real person...,2014-07-10,2014-07-06
"If I find out you didn’t make at least one hour happy, I’m telling your boss, me. You’re fired.",2014-07-10,2014-07-06
A friend in need is a friend that pours me a glass of OJ immediately.,2014-07-11,2014-07-06
There’s some pineapple juice out there that needs some Captain White in it. So fix it.,2014-07-12,2014-07-06
I wish I didn't just start cutting my own hair.,2014-07-12,2014-07-06
I may start cutting my own hair.,2014-07-12,2014-07-06
a/s/l? Mine's 379/Taurus/Ocean.,2014-07-13,2014-07-13
Nights don't become unforgettable by themselves.,2014-07-13,2014-07-13
It's your beach. Own it.,2014-07-13,2014-07-13
"Not gonna lie, these pedicure things sound amazing.",2014-07-14,2014-07-13
Somebody should really start boiling bread in a circular fashion. #bagels,2014-07-14,2014-07-13
"Looks like the 2014 MLB All-Star Game is right around the corner. Hey @AllStarGame, how bout a free bat? My first mate needs a new leg. #ASG",2014-07-14,2014-07-13
"Mondays don’t matter, but Monday nights sure do. #CaptainandCola",2014-07-14,2014-07-13
RT @Canty4Liberty: Tribute hole to my boy @CaptainMorganUS #CapeCod #minigolf,2014-07-15,2014-07-13
"Age-old wisdom doesn’t get old, it gets aged. BIG difference. #NewCaptain",2014-07-15,2014-07-13
RT @tlschwerz: @espngolic from @MikeAndMike with a little @CaptainMorganUS in him haha!,2014-07-15,2014-07-13
The 2014 @allstargame is upon us. Where does your league loyalty lie? AL? NL? All the Ls? #ASG,2014-07-15,2014-07-13
"Damn it. I'm late for an interview. Just kidding, I am the boss. You’re fired.",2014-07-15,2014-07-13
"It's the adventure that always seems to find me. RT @JoeTBA @GinoJRocco @GinoJRocco the Captain, he always wants an adventure!",2014-07-16,2014-07-13
Go forth and Captain.,2014-07-16,2014-07-13
RT @MLB: An exit worth another look. #FarewellCaptain.,2014-07-16,2014-07-13
I slow-roasted a coconut overnight. Who am I?,2014-07-16,2014-07-13
"RT @MLB: “Trust me, it goes quickly.” – Derek Jeter in #ASG address to teammates.",2014-07-16,2014-07-13
@MLB I can raise a glass to that. #TheCaptain #RE2PECT,2014-07-16,2014-07-13
Don’t be that guy.  Be a Captain.,2014-07-17,2014-07-13
Ask for your local bartender for a Captain Morgan Cannonball. It will be the best decision you’ve made in hours.,2014-07-17,2014-07-13
There’s some pineapple juice out there that needs some Captain White in it. So fix it.,2014-07-19,2014-07-13
RT @jash: #jashrubberhead thanks @CaptainMorganUS,2014-07-20,2014-07-20
"I’m up, why aren’t you? No excuse will be acceptable.",2014-07-20,2014-07-20
RT @jash: #jashrubberhead with Sarah Silverman! thanks @CaptainMorganUS!,2014-07-20,2014-07-20
I’ve about had it with these crickets. H-A-D it,2014-07-20,2014-07-20
"Hey mates, ya thirsty?",2014-07-20,2014-07-20
Victory is only a few more passive-aggressive hours away.,2014-07-22,2014-07-20
Get away from my face.,2014-07-22,2014-07-20
Captain White and lemon-lime soda is better than whatever your friend just suggested you drink.,2014-07-23,2014-07-20
Tomorrow is my mom’s birthday so have a drink today.,2014-07-23,2014-07-20
Smells like low tide.,2014-07-24,2014-07-20
I’m awake. Feel free to ask me any question you’d like an honest answer to. You have 6 minutes.,2014-07-24,2014-07-20
Friends don't let friends wake up other friends unless they’ve got bacon sizzling and fresh squeezed OJ. #Facts,2014-07-24,2014-07-20
"Don’t pop bottles, twist them.",2014-07-24,2014-07-20
Finger foods are life.,2014-07-25,2014-07-20
Captain &amp; Cola. It’s my gift to you and the only one you’ve ever allowed to share with another human being.,2014-07-25,2014-07-20
Had a blast last night in San Diego.,2014-07-25,2014-07-20
Time to have as much fun as a wild horse on a beach full of hay.,2014-07-26,2014-07-20
RT @MouseInfo: Met the Captain last night! @CaptainMorganUS #SDCC #CraveOnline #CraveConquersTheCon,2014-07-26,2014-07-20
RT @CraveOnline: #ShowUsYourLoot RT @MouseInfo: Met the Captain last night! @CaptainMorganUS #SDCC #CraveOnline #CraveConquersTheCon,2014-07-26,2014-07-20
There’s a brunch out there with our name on it.,2014-07-27,2014-07-27
"Handsome feels great, doesn’t it?",2014-07-27,2014-07-27
Thinking about getting into fine art.  Anyone got a bowl a fruit  I can stare at for 6 hours?,2014-07-27,2014-07-27
Every good Captain knows when to lower the sails. #AlwaysInModeration,2014-07-28,2014-07-27
Be the best ever. I already am.,2014-07-28,2014-07-27
"Thanks for an epic show on Friday, @CraveOnline. Can I keep the ship?",2014-07-28,2014-07-27
"Sheets, huh? Well that changes everything.",2014-07-28,2014-07-27
Cruller me. Immediately.,2014-07-29,2014-07-27
Your coworkers are looking at your screen and loving every second of this tweet.,2014-07-29,2014-07-27
Put the straw in the coffee then the straw in my mouth then go away.,2014-07-30,2014-07-27
"If you were me, what would you? Exactly. #CaptainandCola",2014-07-30,2014-07-27
To splash some club or not to splash some club. #NewCaptain,2014-07-30,2014-07-27
"You will order a #CaptainandCola tonight. Sshhhhh, yes, yes you will.",2014-07-31,2014-07-27
Your silence means the world to me.,2014-07-31,2014-07-27
It’s not just about winning.,2014-08-01,2014-07-27
Fish sticks for the win.,2014-08-01,2014-07-27
Put me on ice. I love it. #CaptainandCola,2014-08-02,2014-07-27
"If you’re going to do it, own it. #LifeLoveLoot",2014-08-02,2014-07-27
RT @ladygelfling: Oh...well if you insist.... ? @CaptainMorganUS,2014-08-02,2014-07-27
RT @Mike_Conrad: @CaptainMorganUS flying with pride on our vacation!!,2014-08-02,2014-07-27
RT @JakeLewis043: @CaptainMorganUS is my spirit animal,2014-08-02,2014-07-27
I can’t wait to climb a tree tomorrow.,2014-08-02,2014-07-27
Early morning commutes are better when your highway is an ocean.,2014-08-03,2014-08-03
"If you’re gonna talk, at least be nice about it.",2014-08-03,2014-08-03
“Morning people” are not to be trusted.,2014-08-04,2014-08-03
Raise a glass to the men and women of the National Coast Guard. They protect the high seas and have awesome helicopters. Need I say more?,2014-08-04,2014-08-03
Never waste a shore leave. #CaptainsOrders,2014-08-05,2014-08-03
Me and you? We could really be something some day.,2014-08-05,2014-08-03
I am a Captain.,2014-08-06,2014-08-03
Why. Are. Mornings.,2014-08-06,2014-08-03
Your happiness means the world to me.,2014-08-07,2014-08-03
I'll let you drink with my lady just this one time. Do NOT get greedy.,2014-08-07,2014-08-03
Anything can be fun. ANYTHING.,2014-08-08,2014-08-03
Time to go back to having a blast.,2014-08-08,2014-08-03
"If you’re going to do it, own it. #LifeLoveLoot",2014-08-08,2014-08-03
"If you mix it, they will come...and drink it.",2014-08-09,2014-08-03
"Never not have a blast. In fact, have two blasts. You're welcome.",2014-08-10,2014-08-10
Morning people are my worst enemies.,2014-08-10,2014-08-10
Respect the sea and it shall respect you. #AlwaysInModeration,2014-08-10,2014-08-10
Responsibility is the first rule of a good adventure. #AlwaysInModeration,2014-08-11,2014-08-10
"Time for my morning jog. Actually, scratch that. I'm on the ocean.",2014-08-11,2014-08-10
"Hair is glorious. Oops, I meant ""my hair."" Yours is probably ok too, I guess.",2014-08-11,2014-08-10
The worst part about waking up on a ship is the waking up part.,2014-08-12,2014-08-10
Captain &amp; Cola go together like pirates and adventure. #CaptainMorgan,2014-08-12,2014-08-10
Shhhh I'm working. Working on loving life! Amirite?!,2014-08-12,2014-08-10
"If it weren’t for breakfast tacos, there wouldn’t be breakfast. Think about it.",2014-08-13,2014-08-10
RT @DouglifeDouglas: After a long day of work I choose @CaptainMorganUS and their #1671 limited release to celebrate.,2014-08-13,2014-08-10
"#CaptainAndCola. Better than land. And, most times, easier to find.",2014-08-13,2014-08-10
I’ve had the same dream every night for 300 years. Hint: There’s so much chocolate.,2014-08-13,2014-08-10
Be the bigger Captain. #AlwaysInModeration,2014-08-14,2014-08-10
"Well, it's time to chew a handful of coffee beans and crush today.",2014-08-14,2014-08-10
Accepted the #IceBucketChallenge from @JoesDaily &amp; donated $10K to #StrikeOutALS. Your turn! You have 24 hours.,2014-08-15,2014-08-10
Time for my 6 hour nap. I call it a nap because then it feels like I'm just preparing to have fun again.,2014-08-15,2014-08-10
Weekend domination begins with Captain &amp; Cola.,2014-08-15,2014-08-10
Real Captains drop anchor. #AlwaysInModeration,2014-08-16,2014-08-10
"This one's called the ""Buried Treasure"" because there's gold in it. GET IT??",2014-08-16,2014-08-10
Moonlight is delicious.,2014-08-16,2014-08-10
RT @Gunaxin: Today is National #RumDay and @CaptainMorganUS has plenty of ways to celebrate!,2014-08-16,2014-08-10
It’s #NationalRumDay and I'm hanging out with a bunch of friends in Las Vegas!,2014-08-16,2014-08-10
"I see you coming sleep and, well, ok. Let’s tango.",2014-08-17,2014-08-17
Be better than everyone.,2014-08-17,2014-08-17
Know when to lower your sails. #AlwaysInModeration,2014-08-18,2014-08-17
Don't hate Mondays. They never did anything to you.,2014-08-18,2014-08-17
Always choose fun. Unless there's captain and cola. Then choose both.,2014-08-18,2014-08-17
Only 10 and 1/2 more hours till Happy Hour.,2014-08-19,2014-08-17
Find a mate. Then drink with them. It's that simple.,2014-08-19,2014-08-17
"Dear Maidens, thank you. Love, #CaptainMorgan",2014-08-19,2014-08-17
I feel so alive right now.,2014-08-20,2014-08-17
Make your own last call. #AlwaysInModeration,2014-08-20,2014-08-17
You think selfies are annoying? Try sitting still on a horse for three days while a stranger paints your picture. #TBT,2014-08-21,2014-08-17
The original champion of adventure. #CaptainMorgan,2014-08-21,2014-08-17
The high seas can wait. #AlwaysInModeration,2014-08-22,2014-08-17
No plans? Well make some because it’s Friday and you’re a champion. #CaptainMorgan,2014-08-22,2014-08-17
The first person to guess my middle name has a high five with their name on it.,2014-08-22,2014-08-17
Un-complicate your evening with just two ingredients. #CaptainAndCola,2014-08-23,2014-08-17
My “bed hair” is also my “all the time hair” just so I can wake up whenever I want and no one has any idea.,2014-08-23,2014-08-17
Here’s the thing. Salads. Why?,2014-08-24,2014-08-24
"Hey Mate. Yeah, you. Great hair.",2014-08-24,2014-08-24
A safe crew is a loyal crew. #AlwaysInModeration,2014-08-24,2014-08-24
"Hey Tuesday night, I’m coming for you. Sincerely, #CaptainMorgan",2014-08-25,2014-08-24
Know when to take the lead. #AlwaysInModeration,2014-08-25,2014-08-24
Dolphins. The alarm clocks of the sea.,2014-08-25,2014-08-24
Tuesday night is the new 3-day weekend. #CaptainMorgan,2014-08-25,2014-08-24
You are all my friends.,2014-08-25,2014-08-24
"@JonathanMannion perfectly executes the #1 party guest rule: ""Bring what you love, share if you must."" #CaptainMorgan",2014-08-26,2014-08-24
I’m going to eat everyone’s breakfast.,2014-08-27,2014-08-24
Everything about right now is right now and I’m into it.,2014-08-27,2014-08-24
You don’t always have to reload the cannon. #AlwaysInModeration,2014-08-27,2014-08-24
It's Thursday and I'm Thirsty.,2014-08-28,2014-08-24
Lay the course for a safe journey home. #AlwaysInModeration,2014-08-28,2014-08-24
It's Friday and your mates need you. Grab some Captain and make it the best night of your lives. #LifeLoveLoot,2014-08-29,2014-08-24
Dancing really only requires a mop and a great imagination.,2014-08-29,2014-08-24
"Stop trying to hide from me, breakfast. Stop it immediately.",2014-08-29,2014-08-24
"Today, we party. Also tomorrow and the day after. #LaborDay",2014-08-30,2014-08-24
Man I love this red coat.,2014-08-30,2014-08-24
Always Captain by example. #AlwaysDrinkResponsibly,2014-08-31,2014-08-31
MUTINNNNNYYYYYYYYYYY! Hello?,2014-08-31,2014-08-31
